{
  "$schema": "../schemas/workload.v1.json",
  "workload_id": "bos-single-token",
  "version": "1.0.0",
  "tokenizer_id": "gemma4-12b-8bit",
  "prompt_token_ids": [2],
  "prompt_length": 1,
  "output_budget": 1,
  "sampler_config": {
    "temperature": 0,
    "top_k": 1,
    "top_p": 1.0
  },
  "eos_behavior": "stop",
  "context_policy": "extend",
  "required_checkpoints": []
}
